{"schemaVersion":"IMAGE_STOCK_V1","runId":"image-run-20260817T114711-6df03a","status":"SUCCESS","startedAt":"2026-08-17T11:47:11Z","baseSha":"4b2ce006ca97445e29d36a1c7c8a2062b868c859","mainHeadAtStart":"d3079795288e17548ecfc7cba83804f40476665b","attempt":1,"previousAttempts":[],"items":[{"stockId":"panama","stockPath":"stock/items/panama.json","imagePath":"stock/images/panama/primary.webp","inputStatus":"IMAGE_PENDING","attachmentMapping":{"confirmed":true,"sourceFileName":"E95F0E5A-D43F-4719-9BA1-044CCAE9C1AC.jpeg"},"webpVerified":true,"evidenceCheck":{"result":"PASS","checkedAgainst":["visualPreparation.evidence","visualPreparation.alt","visualPreparation.rights","visualPreparation.scope"],"note":"PASS: the supplied image shows a tall, visibly branched sativa-oriented flowering structure with dense resinous clusters, abundant trichome detail, reddish-to-pink pistils, and narrow foliage; it does not introduce dramatic purple coloration."},"visual":{"role":"primary","src":"stock/images/panama/primary.webp","aiGenerated":true,"sourceType":"aiGenerated","rights":"AI-generated project asset planned for Cannabis Strain Wisdom; no third-party image will be copied. Visual prompt is derived from cited factual morphology evidence.","alt":"Panamaの背が高く枝分かれしたサティバ形態と、赤〜桃色の雌しべを含む樹脂質な花を表現したAI生成参考ビジュアル","scope":"cultivar"}},{"stockId":"shaman","stockPath":"stock/items/shaman.json","imagePath":"stock/images/shaman/primary.webp","inputStatus":"IMAGE_PENDING","attachmentMapping":{"confirmed":true,"sourceFileName":"1F3C7B4A-081C-4C8D-9F3A-6DAA27A3383E.jpeg"},"webpVerified":true,"evidenceCheck":{"result":"PASS","checkedAgainst":["visualPreparation.evidence","visualPreparation.alt","visualPreparation.rights","visualPreparation.scope"],"note":"PASS: the supplied image shows elongated, comparatively open flower columns with narrow foliage and a natural green base plus pink-to-purple flower coloration, consistent with the cited Shaman morphology and coloured phenotype evidence."},"visual":{"role":"primary","src":"stock/images/shaman/primary.webp","aiGenerated":true,"sourceType":"aiGenerated","rights":"AI-generated project asset planned for Cannabis Strain Wisdom; no third-party image will be copied. Visual prompt is derived from cited factual morphology evidence.","alt":"Shamanの開いたサティバ優勢形態と、桃色〜紫色の花色が現れる表現型を示すAI生成参考ビジュアル","scope":"cultivar"}},{"stockId":"california-octane","stockPath":"stock/items/california-octane.json","imagePath":"stock/images/california-octane/primary.webp","inputStatus":"IMAGE_PENDING","attachmentMapping":{"confirmed":true,"sourceFileName":"BF182B2B-EC50-40EC-9F26-813216BB0A6D.jpeg"},"webpVerified":true,"evidenceCheck":{"result":"PASS","checkedAgainst":["visualPreparation.evidence","visualPreparation.alt","visualPreparation.rights","visualPreparation.scope"],"note":"PASS: the supplied image shows very dense, stacked flower clusters with heavy visible trichome coverage and natural green-to-tan coloration, matching the cited California Octane visual evidence without invented dramatic purple coloration."},"visual":{"role":"primary","src":"stock/images/california-octane/primary.webp","aiGenerated":true,"sourceType":"aiGenerated","rights":"AI-generated project asset planned for Cannabis Strain Wisdom; no third-party image will be copied. Visual prompt is derived from cited factual morphology evidence.","alt":"California Octaneの密に重なった花と強いトリコーム被覆を表現したAI生成参考ビジュアル","scope":"cultivar"}}],"transaction":{"branch":"master-migration","commitCount":1,"refUpdateCount":1,"forceUsed":false,"branchCreated":false,"method":"blob-tree-commit-ref-update"},"audit":{"baseMatchedBeforeWrite":true,"allChangedFilesUnderStock":true,"mainUnchanged":true,"protectedTreesUnchanged":true,"existingImagesUnchangedExceptTargets":true,"changedFiles":["stock/images/panama/primary.webp","stock/images/shaman/primary.webp","stock/images/california-octane/primary.webp","stock/items/panama.json","stock/items/shaman.json","stock/items/california-octane.json","stock/image-runs/image-run-20260817T114711-6df03a/run.json"],"reason":"Prepared as one IMAGE STOCK V1 transaction. Final SUCCESS is contingent on the authoritative post-write GitHub audit in the same execution turn."}}
